{
  "id": "10",
  "name": "Abandonment",
  "class": "Tank",
  "element": "Water",
  "rarity": "Rare",
  "description": "Describe this voidpet...",
  "levels": {
    "1": "/assets/voidpets/abandonment/1.svg",
    "2": "/assets/voidpets/abandonment/2.svg",
    "3": "/assets/voidpets/abandonment/3.svg",
    "4": "/assets/voidpets/abandonment/4.svg",
    "5": "/assets/voidpets/abandonment/5.svg"
  }
}
