{
  "id": "37",
  "name": "Wonder",
  "class": "Healer",
  "element": "Wood",
  "rarity": "Rare",
  "description": "Describe this voidpet...",
  "levels": {
    "1": "/assets/voidpets/wonder/1.svg",
    "2": "/assets/voidpets/wonder/2.svg",
    "3": "/assets/voidpets/wonder/3.svg",
    "4": "/assets/voidpets/wonder/4.svg",
    "5": "/assets/voidpets/wonder/5.svg"
  }
}
