{
  "id": "07",
  "name": "Paranoia",
  "class": "Fighter",
  "element": "Metal",
  "rarity": "Epic",
  "description": "Describe this voidpet...",
  "levels": {
    "1": "/assets/voidpets/paranoia/1.svg",
    "2": "/assets/voidpets/paranoia/2.svg",
    "3": "/assets/voidpets/paranoia/3.svg",
    "4": "/assets/voidpets/paranoia/4.svg",
    "5": "/assets/voidpets/paranoia/5.svg"
  }
}
